title,description,price,images_url,location
3 BHK DOPLEX HOUSES,1. gated community2. 24*7 security3. over head water tank4. under ground drainage system5. avenue plantation6. electricity7. gated developments available8. near keesara gutta temple9. east facing 10% extra10. amenities 10% extra,"₹ 72,28,000",https://apollo-singapore.akamaized.net:443/v1/files/rxhxvfes05o43-IN/image,"India, Telangana, Hyderabad, Dammaiguda"
Kazpipet vishnupuri near Sneha chicken center g+1+penthouse,G+1+penthouse NOW rent's coming 14000/- near KZP Railway Station 900metrs market 200 metes near school's &hospital & bus stop  only honest byea's,"₹ 75,00,000",https://apollo-singapore.akamaized.net:443/v1/files/idlc22afgsiu2-IN/image,"India, Telangana, Warangal, Kazipet"
KOMPALLY (BOLLARAM)  APARTMENTS 2999 PER SFT,KOMPALLY (BOLLARAM) APARTMENTS2999 RS PER SFT1.5 KM FROM NATIONAL HIGHWAYFULLY GATED COMMUNITY  GHMC RERA APPROVED4 ACRES FULLY GATED COMMUNITYG+5 FLOORS  1.5 YEAR HANDOVERPAYMENT OPTIONS:-1.OUTRATE  2999 PER SFT INCLUDING EMINITIES & CAR PARKING2.LOAN 3499 PER SFTINCLUDING EMINITIES & CAR PARKING,"₹ 32,00,000",https://apollo-singapore.akamaized.net:443/v1/files/p18zr33ivwx63-IN/image,"India, Telangana, Hyderabad, JNTU"
Premium 2bhk flats@Moti Nagar,Premium 2bhk flats in 25 acres gated community in the centre of city with all world class amenities and full of greenery built in the community.,"₹ 91,00,000",https://apollo-singapore.akamaized.net:443/v1/files/m25pclta356a-IN/image,"India, Telangana, Hyderabad, Moti Nagar"
Single bedroom hall kitchen,1 BHK 24 hours water supply,"₹ 5,500",https://apollo-singapore.akamaized.net:443/v1/files/06xik0c05nvs-IN/image,"India, Telangana, Hyderabad, Sai Nagar Colony"
Per sft.5100/-at  nanakramguda circle most luxury appartments road fc,"World class imminities  club houseMini theatre ,duplex appartments ,and prime location near to 2kms of GACHIBOWLI  OPP to Delhi public school this offer only few days","₹ 51,00,000",https://apollo-singapore.akamaized.net:443/v1/files/uihq61ovrrzc-IN/image,"India, Telangana, Hyderabad, Film Nagar"
Nearby Heritage Mart Best Facilities of 2Bhk Flat Developed Area Uppal,"Details Of Flat 900 sft 1st floor, East face10 years building with All Amenities LIKE :  Marble Flooring             Lift, generator Full Security 24 Hours Municipal & Bore water avail Apartment Location Uppal Balaji hills Near Main bus stop Asian Multiplex 2 km From Warangal highway Clear title Property Immediately registration 100% Vasth Near Developments and Facilities * Uppal Main Bus stop * South india Shopping mall * Uppal metro station * Venkateswara temple 10 mins drive from Uppal ring road Inter national schools, Colleges Multi hospitals, Banks, atm's All facilities avail Cost of Property RS/- 39,00,000","₹ 39,00,000",https://apollo-singapore.akamaized.net:443/v1/files/wtocc7k8c2ee3-IN/image,"India, Telangana, Hyderabad, Uppal"
"NANAKRAM GUDA CERCLE JUST 30 MTRS ,ROAD FACING PROJECT.WORLD CLASS PRO",DELHI PUBLIC SCHOOL OPPOSITE HMDA PROJECT.WORLD CLASS AMENITIES.,"₹ 22,00,000",https://apollo-singapore.akamaized.net:443/v1/files/7ladsjumise6-IN/image,"India, Telangana, Hyderabad, Nanakramguda"
1bhk- flat tolet,"Elevator, security, cctv, 24 hrs water","₹ 9,500",https://apollo-singapore.akamaized.net:443/v1/files/c8r7isefqiue1-IN/image,"India, Telangana, Hyderabad, Madhapur"
2bhk 900sqft 1st floorSuncity bandlaguda jagir near maple town villas,2bhk 900sqft first floor suncity bandlag uda jagir,"₹ 7,000",https://apollo-singapore.akamaized.net:443/v1/files/r779euuthfbu2-IN/image,"India, Telangana, Hyderabad, Janibegun"
"Kondapur,2&3bhk ready to move &under construction flats for sale","A 2bhk property is available for sale in kondapur, Hyderabad. It has a salable area of 1199,&1139,sqft and is available at a price of Rs. 5300/sft. It is located on the 1,2,3rd&4th floor(out of a total of 5 floor(s)). the amenities are intercom facility,cc cams,car parking ,power backup , seciruty, manjeera and boars.The property provides an excellent view as it overlooks the road. The property is available on freehold. The property has 2bathrooms and 2 balcony. This residential property is . It is made in way to provide a comfortable living for the residents.","₹ 62,00,000",https://apollo-singapore.akamaized.net:443/v1/files/9pvyoss1ul331-IN/image,"India, Telangana, Hyderabad, Kondapur"
Very good location nary  by park,Very good  location,"₹ 1,26,00,000",https://apollo-singapore.akamaized.net:443/v1/files/kcylsumhe3no2-IN/image,"India, Telangana, Hyderabad, Ameerpet"
Bus Stop Beside 1100 sft East Direction Apartment Flat Locality Uppal,"1100 sft 2nd FloorEast direction Full Wood Work 10 Years building Clear title Immediately registration 100% Vasth With all amenities Free LIKE : Lift, generator, Car parking            24/7 Security Full manjeera and Bore water avail Marble flooring ect... Locality of Flat Uppal  Balaji hills Near Venkateswara temple 2 km from warangal highwayNear Facilities International schools, Colleges Multi hospitals, banks, atm's Shopping malls, theaters Family restaurantsBeauty parlors ect...Best Price of Property RS/- 40,00,000for more details please contact me","₹ 40,00,000",https://apollo-singapore.akamaized.net:443/v1/files/tjo99iirsgg31-IN/image,"India, Telangana, Hyderabad, Uppal"
Independent house for sale at alwal near bolaram,"House for sale at alwal near bolaram, west facing, ground floor, 2bhk, 150 sq yards, 1250 sq ft built up area, ready to move property","₹ 85,00,000",https://apollo-singapore.akamaized.net:443/v1/files/yof2ep6c76191-IN/image,"India, Telangana, Hyderabad, Alwal"
3 bhk flats for sale at brindavan colony Tolichowki,Flats for sale 3 bhk @ brindavan colony Tolichowki near masjid e IslandA spacious enclosure for sunlight  &breeze Exquisitely planning Two liftsBranded fitingsProper ventilation Functionally superior Modern amenities Wide staircase Appealing exterior Water harvesting pit Invertors for individual flats For more details contact,"₹ 75,17,100",https://apollo-singapore.akamaized.net:443/v1/files/z07w5it3updc2-IN/image,"India, Telangana, Hyderabad, Sabza Colony"
Indipendent two side road home,"Independent Home on 138 sq yds .Two side road both sides 40 feet road. 2 bed room..one dining hall one sit out area.. one commom room ...all together 4 rooms ..Mallikarjuna colony, road no 4, old bowenpally secundrabad. Brokers stay away please .old home of 26 yrs... Rate fixed","₹ 86,00,000",https://apollo-singapore.akamaized.net:443/v1/files/qx3pm92bcaby2-IN/image,"India, Telangana, Secunderabad, Old Bowenpally"
1BHK Unfurnished Flat,1BHK Unfurnished Flat available in kondapur rent is 10k,"₹ 10,000",https://apollo-singapore.akamaized.net:443/v1/files/oh2uohpqtl3d1-IN/image,"India, Telangana, Hyderabad, Kondapur"
House for sale at alwal near bolaram,"House for sale at alwal near bolaram, new Construction, east facing, G+1, 4bhk, 167 sq yards, 2700 sq ft built up area, ready to move property","₹ 1,38,00,000",https://apollo-singapore.akamaized.net:443/v1/files/ad0x2tv6pq5q3-IN/image,"India, Telangana, Hyderabad, Alwal"
2 bhk Azampura,beside muslim hospital azampura,"₹ 46,00,000",https://apollo-singapore.akamaized.net:443/v1/files/m6yo2ei10tid-IN/image,"India, Telangana, Hyderabad, Usman Pura"
2 BHK on second floor @Pillar No. 194,"2 BHK flat available in a serene and official colony Ashok Vihar at pillar no. 194. It's the official colony of NMDC officers. If you like lot of greenery and clean air, this is the colony for you. Ample water - both ground and manjeera available. I'm unable to read your messages so contact me directly on my phone.","₹ 10,000",https://apollo-singapore.akamaized.net:443/v1/files/ga4nex1ok1in-IN/image,"India, Telangana, Hyderabad, Rajendra Nagar"
Independent house for sale in Badangpet,"Independent House for Sale. 180 sqr yards, West Face 36'x45', 2013 - Construction. No brokers","₹ 90,00,000",https://apollo-singapore.akamaized.net:443/v1/files/2hd9smkt8nb43-IN/image,"India, Telangana, Hyderabad, Badangpet"
Laxury Gated Community Flats For Sale,"2BHK & 3BHK HI-RISE PREMIUM GATED COMMUNITY FLATS @ Gopanapally(Financial Dist)680 PREMIUM LUXURY 2BHK&3BHK FLATS6.5 ACRES8 TOWERSG+9LUXURIOUS GATED COMMUNITY FLATS @GOPANPALLIBeside Wipro Office Giving World Class Aminities..BOOKING AMOUNTRS. 500000/-OPTION-1RS. 3699/- sq ftOne Time Payment Including Booking Amount (30days total payment ) OPTION-2RS. 4599/- Sq.ft50% Payment in 30 Days   Remaining 50% Payment Go for Loan or Construction wise Payment.OPTION-3 RS. 5599/- sq.Ft20% In a month Including Booking AmountRemaining 80% Bank loanOr Progress of Construction It Will Be Handover in  2023AMENITIES INCLUDE CLUB HOUSE AND CAR PARKING:2BHK--RS. 500000/-3BHK--RS. 650000/-RS. 30/- Floor Charges apply from 6th Floor onwards..East facing charges 100 extraLocation Highlights:1) Near by Financial District and QCity2) 10 Min to  Wipro Circle,All TOP MNC's3) 15 min Drive from Lingampalli and Gachibowli4) 30 Min to Shmshabad Airport5) 15min Drive from  DLF 6) 15 Min Drive from Hitec City","₹ 70,00,000",https://apollo-singapore.akamaized.net:443/v1/files/6kws10s0vlho-IN/image,"India, Telangana, Hyderabad, Gopanpally"
133 sq yards 1075 sft 2 bhk proposed house Yadgarpally,133 sq yards 1075 sft gated community venture HMDA VENTURE MAIN RODAnote 10% extra for amenities,"₹ 48,00,000",https://apollo-singapore.akamaized.net:443/v1/files/wej8kfo0obz5-IN/image,"India, Telangana, Hyderabad, Cheeriyal"
House for sale at alwal,"House for sale at alwal, new Construction, east facing, G+1, 2700 sft built up area, ready to move property","₹ 1,35,00,000",https://apollo-singapore.akamaized.net:443/v1/files/01o595kx6xdj3-IN/image,"India, Telangana, Hyderabad, Alwal"
ELEGANT HOMES,LUXURY INDEPENDENT HOUES GATKESAR150 SQYRD (1050 SFT)100% 3900000  50%CASH 50%LOAN 4500000   25%CASH  75%LOAN 5100000   BOOKING ADVANCE 500000 NEAR BY DEVELOPMENTS1. ACE ENGINEERING COLLEGE2. MEGHA ENGINEERING COLLEGE3. DELHI PUBLIC SCHOOL4. SRI KRISHNA COLLEGE5.UPPAL TO GATKESAR 16KM6. INFOSYS (POCHARAM) 10KM7. ORR 5KM8. WARANGAL HIGHWAY5KM,"₹ 39,00,000",https://apollo-singapore.akamaized.net:443/v1/files/jr7qknepfhnk1-IN/image,"India, Telangana, Hyderabad, Ghatkesar"
Triplex Villa for sale for at kompally,"Triplex Villa for sale at kompally near bolaram, east facing, 200 sq yards, 50ft road facing, 3500 sft built up area","₹ 1,90,00,000",https://apollo-singapore.akamaized.net:443/v1/files/1f9bq0vpk6nm3-IN/image,"India, Telangana, Hyderabad, Kompalli"
1 BHK Flat available for rent,"1 BHK Flat  available  for rent in Manikonda , Maruti nagar colony. All super markets and schools are walk able distance . It's a new standalone apartment with 24 hrs water , security and Lift facilities available. Rent includes maintenance, Ideal for small family/couple.Close to Hitech city Gachibowli 4 to 8 km radius Raheja Mind Space, Wells Fargo, Invesco, IBM, Accenture, Wipro Hitachi Deloitte Polaris,ICICI knowledge park Cyber Gateway Pearl TCS IBM Wells Fargo Microsoft etcPlease contact me for more information.","₹ 10,000",https://apollo-singapore.akamaized.net:443/v1/files/agt4i7n160xa1-IN/image,"India, Telangana, Hyderabad, Manikonda"
2BHK Semi Furnished Flat,"This is 2bhk semi furnished flat available in Sri Nagar Colony , Hyderabad only for family with car parking","₹ 20,000",https://apollo-singapore.akamaized.net:443/v1/files/4qhw7gzzg4yq2-IN/image,"India, Telangana, Hyderabad, Sri Nagar Colony"
Semi Furnished Flat on rent in Raghavendra colony 1bhk.,"Semi Furnished Flat on rent in Raghavendra colony 1bhk.House Amenities: Modular  Kitchen,cupboards,security,lift.","₹ 12,000",https://apollo-singapore.akamaized.net:443/v1/files/44qzkitcgey31-IN/image,"India, Telangana, Hyderabad, Raghavendra Colony"
URGENT 2 BHK FLAT FOR RENT/LEASE IN BANDLGUDA(newly constructed),2 BHK flat for rent or lease in prime location close to progress high school in subhan colony bandlguda.It consists of 1 bedroom with attached bathroom and drawing room with an hall and a kitchen.The flat is newly constructed with 24 hrs water supply and electricity connection.The rent is 8000 pm or lease at 6lakhs for 2 years. The price is slightly negotiable .Only serious tenants may contact.,"₹ 8,000",https://apollo-singapore.akamaized.net:443/v1/files/o1mywkdo9wi93-IN/image,"India, Telangana, Hyderabad, Bandlaguda"
2BHK Semi Furnished Flat,This is 2bhk flat available in kondapur,"₹ 17,000",https://apollo-singapore.akamaized.net:443/v1/files/z6h7v21uht5c3-IN/image,"India, Telangana, Hyderabad, Kondapur"
House for sale,"House for saleKorutla, jhansi road","₹ 35,60,000",https://apollo-singapore.akamaized.net:443/v1/files/m4mvuisam3xo1-IN/image,"India, Telangana, Koratla, Dheemuni Dubba"
"Ram Nagar, Gangaputra Colony, Parsigutta, HYD – Old Independent House","Ram Nagar, Gangaputra Colony, Parsigutta, HYD – Old Independent House is for sale172 sq.yardsEast Face28 feet wide roadPrice is 65 K per sq.yard Total of Rs. 1.12 cr. NegotiableGround Floor OnlyGood AreaPlease interested buyers only can callIf you are interested please call us at As we, SV Properties Real Estate Agents will charge Rs 2000/- towards consultancy charges and 1% commission on sale considerationSV Properties, Nallakunta, HYD","₹ 1,12,00,000",https://apollo-singapore.akamaized.net:443/v1/files/k7qrucvh20nb3-IN/image,"India, Telangana, Hyderabad, Ram Nagar"
"East Facing 2BHK Flat for sale in Aliens Elite, Miyapur","Well Designed East Facing 2 BHK apartment of 806 SFT is available for sale in Aliens Elite, a gated community located at Prashanth Nagar, Miyapur. The property is on 3rd floor (out of 5 floors per block) and is a corner flat with very good ventilation. Approx 1 Km from Mumbai Highway, 3.5 kms from Miyapur metro station, the property is available in a very decently maintained residential area which is close to many malls, schools and hospitals.The community has all the amenities like clubhouse, gym, swimming pool, park, children's play area, piped gas, community hall, indoor and outdoor sports etc...Flat is 10 yrs old. but comes with good construction quality and maintenance. Wood work is done in both bedrooms and kitchen.Sale price is INR 45,00000/- including reserved parking and amenities. Registration charges extra and to be borne by the buyer as per Govt norms.","₹ 45,00,000",https://apollo-singapore.akamaized.net:443/v1/files/kkb0nkb5hinc-IN/image,"India, Telangana, Hyderabad, Madinaguda"
House for sale at kompally,"House for sale at kompally near bolaram, new Construction, east facing, G+1, 4bhk, 183 sq yards, 2900 sft built up area,","₹ 1,55,00,000",https://apollo-singapore.akamaized.net:443/v1/files/7jnhysd27l7h1-IN/image,"India, Telangana, Hyderabad, Kompalli"
1000 sft 2 bhk Proposed  independent house  Near By Ecil,"-120 sqyds -1000 sft -west facing -With G+2 permission -Loan approved projects -Near By Schools,colleges,hospitals,and super markets","₹ 42,00,000",https://apollo-singapore.akamaized.net:443/v1/files/6tmho4jn5cem1-IN/image,"India, Telangana, Hyderabad, ECIL"
1000sft Apartment flat ready to move Available in ecil,"1000sft 2bhk apartment flat in dammigudaventure high lights1) Compound Wall around the Venture2) C C Roads3) Round the Clock Security4) 24 Hours water & Electricity5) Under Ground Drainage System6) Avenue Plantation7) Childrens Play Area8) Super Marketlocation1) 3 Kms From Ecil,2) 1 Kms From Nagaram,3) 5 Km Distance To Cherlapally Railway Station,4) 5 Kms To Info Sys5) Adjacent Nagaram Arogya Vanam 100 Acrs Parknear by high lights1) Loan Aprroved Project From Nationalized Banks & Gic 80% On Offer Price2) Near To Requel Ford International School, Jubeeli Hills Public School, St Anndrews School3) Near To More & Ushodaya Super Market, Vishal & Dmart4) Very Close To The Aditya Multi Speciality Hospitals, Vijaya & Sudha Hospitals5) 10 Minits Drive To Pocharam Infosys And It Caridor6) With In The Orr Keesara & Gathkesar, With Ghmc Limits7) 5 Mins Driver to ORR10% Extra Amenities charges","₹ 39,00,000",https://apollo-singapore.akamaized.net:443/v1/files/bkxe80v6ym5n3-IN/image,"India, Telangana, Hyderabad, ECIL"
Buy a plot get a free villa nd loyalty,Buy a plot get a free villa nd loyalty (1crore worth villa or 1crore cash back scheme) prime location near by ORR surrounded by growth corridor,"₹ 44,99,999",https://apollo-singapore.akamaized.net:443/v1/files/wmx2lj3wxond2-IN/image,"India, Telangana, Quthbullapur, Dundigal"
"2BHK Flat at Bandlaguda, Nagole is ready to move within 3 months","It's a high end gated Community situated at Bandlagiluda, Nagole is for sale. Having Club House which includes A/c Gym, A/c Function Hall, Guest houses, Swimming pool for Adults and Children etc... It will be ready by Mach 2021.","₹ 62,81,000",https://apollo-singapore.akamaized.net:443/v1/files/euxnv8ja7fp42-IN/image,"India, Telangana, Hyderabad, Mansoorabad"
Luxury Villas Pre-launch@Kollur,Luxury villas in a gated community of 40 acres with all amenities at pre-launch sale in Kollur274 Sq.Yrds with 3690 Sft optional 318 sq yards with 274 + 44,"₹ 1,70,00,000",https://apollo-singapore.akamaized.net:443/v1/files/so8u2tmw42ko1-IN/image,"India, Telangana, Hyderabad, Kollur"
"Ram Nagar, Parsigutta Road, HYD – Independent House is for sale","Ram Nagar, Parsigutta Road, HYD – Independent House is for saleNorth West Corner220 sq.yardsGround Floor OnlyPrice is 60 K per sq.yard Total of Rs 1.32 Cr.Good AreaPlease interested buyers only can call As we, SV Properties Real Estate Agents will charge Rs 2000/- towards consultancy charges and 1% commission on sale considerationIf you are interested please call us at SV Properties, Nallakunta, HYD","₹ 1,32,00,000",https://apollo-singapore.akamaized.net:443/v1/files/l23tjkiajun-IN/image,"India, Telangana, Hyderabad, Ram Nagar"
Independent G+1 House at Bahadurpura,"We offer Independent G+1 well constructed house at  Nagar Colony Bahadurpura.  House is newly & well constructed and in excellent condition.  Marble flooring at Ground Floor, Tiles in Washrooms Kitchen, Entire house has ceiling, Birla putti Lappam in entire house. 100 sq yrd G+1","₹ 70,00,000",https://apollo-singapore.akamaized.net:443/v1/files/hxsgodp2obz72-IN/image,"India, Telangana, Hyderabad, Bahadurpura"
Hospital for Lease,Hospital lease,"₹ 4,00,000",https://apollo-singapore.akamaized.net:443/v1/files/gxt2awj0sq4r2-IN/image,"India, Telangana, Miryalaguda, Doctors Colony"
Flat for sale at nallagandla,Flat for sale at nallagandlaG+5floors 15flats only 3bhks 1700sft,"₹ 90,00,000",https://apollo-singapore.akamaized.net:443/v1/files/b24vc8z6ltue2-IN/image,"India, Telangana, Hyderabad, Nallagandla"
Flats available and newly constructed,Fully furnished apartment and available for all the things,"₹ 10,000",https://apollo-singapore.akamaized.net:443/v1/files/6qpa1eecpqcc-IN/image,"India, Telangana, Hyderabad, Madhapur"
INDEPENDENT DUPLEX IN LOW COST URGENT SALE OFFER PRICE.  103 SQ YARD,INDEPENDENT DUPLEX IN LOW COST URGENT SALE OFFER PRICE.    FULL FURNITURE.   WITH CC CAMERAS TOTAL AROUND OF HOUSE.   IF ANYBODY INTERESTED CALL ME IMMEDIATELY.     LOCATION:- (SUNCITY HYDERABAD)FROM OUTER RING ROAD 3 KILOMETRESPRIME LOCATIONNEAR TO GACHIBOWLITHIS IS THE BEST OPPORTUNITY TO TAKE THE DUPLEX THANK YOU MY FRIENDS IF ANYBODY INTERESTED CALL ME,"₹ 96,00,000",https://apollo-singapore.akamaized.net:443/v1/files/9zchbs3r1pv22-IN/image,"India, Telangana, Hyderabad, Hitech City"
Master Bed room for 2 students or job holders ladies only,Only rent basics,"₹ 5,000",https://apollo-singapore.akamaized.net:443/v1/files/5pdzpkvh27fe1-IN/image,"India, Telangana, Hyderabad, Mithila Nagar"
Room for Rent 4200 /,Single room for rentFacilities : 24 Hrs water                   24 Hrs Electricity                    Big room Price.      : 4200/,"₹ 4,200",https://apollo-singapore.akamaized.net:443/v1/files/q452bezgkyfv3-IN/image,"India, Telangana, Hyderabad, Asif Nagar"
Flat for Rent,"VishnuTeja ResidecySri Chaitanya Olympiad school, Dattatreya Nagar, Chanakyapuri colony to Mallapur 500076Rent 9000Maintenance 900","₹ 9,000",https://apollo-singapore.akamaized.net:443/v1/files/nehsajw4klw1-IN/image,"India, Telangana, Hyderabad, Marriguda"
Sadashivpet Town Mega Gated Community Simplex Houses,"2&3bhk simplex houses at sadasivpet town with mega gated community amenities provided like children’s play area, community hall , club house, jogging track , gym , 40ft roads etc.. all back loans available .just 5min drive to NH-65 Mumbai highway , 20min to ORR, TOSHIBA ,GITAM ,10min to IIT,15min to NIMZ","₹ 50,92,000",https://apollo-singapore.akamaized.net:443/v1/files/cslhfosk2n3o2-IN/image,"India, Telangana, Hyderabad, Sadasivpet"
"F. No :102, shri shubham residency , anjaneya towers",Semi furnished flat,"₹ 32,00,000",https://apollo-singapore.akamaized.net:443/v1/files/8cl9o3ou0tnm3-IN/image,"India, Telangana, Hyderabad, Badangpet"
150 SQ YARDS 1250SFT INDEPENDENT HOUSE AVAILABLE IN NAGARAM NEAR ECIL,"-just 6km from ecil-Amenities 10% extra -150sqrds,1250sft, west facing In Nagaram, Rl Nagar-18km from Secunderabad Railway station-5Minits Drive from Charlapalli railway station-3Km from Outer Ring Road-Very close to supermarket, pharmacy,Dance studio, Baby care center, children’s play area, school & convention Hall, engineering colleges, hospitals,shopping malls, grocery stores,pharmacy ,ATM good transportation connectivity,Buses,autos Etc ..-Bank Loan Facility Available.Nearby Schools: Gouthami group off school,Oak valley international school, SR Digi school-Colleges: sri vaishnavi Jr.collage-Nearby Hospitals: Shri Adhithya Hospital, sun life's hospital-Nearby shopping malls: MVR Arcade nagaram,Kalyana mahalaxmi shopping mall-Nearby Temples: Sri Bala Anjaneya Swamy temple-Nearby Markets: more supermarket, Heritage fresh market","₹ 71,00,000",https://apollo-singapore.akamaized.net:443/v1/files/zkznzh1phe853-IN/image,"India, Telangana, Hyderabad, Nagaram"
Per sft just 4200/-.near nanakramguda cercle.Road face  project.,World class aminities.Beside nanakramguda cercle.This offer just few days.,"₹ 42,00,000",https://apollo-singapore.akamaized.net:443/v1/files/hu8b1g5px2l1-IN/image,"India, Telangana, Hyderabad, Banjara Hills"
Asif Nagar 204 sq yards semi commercal house for sale,"Semi commercal 204 sq yards g+3 pen house 2 shutters 6 flats 2bhk per floor monthly rental income 100000 location asif nagar back side of police station line final price 2,20,00000","₹ 2,20,00,000",https://apollo-singapore.akamaized.net:443/v1/files/px66wehsq8se3-IN/image,"India, Telangana, Hyderabad, Asif Nagar"
LRS PAID 2BHK 850 SFT PROPOSED HOUSE AVAILABLE NEAR ECIL IN AHMADGUDA,This house available in bandlaguda near ecil;Distance  to ecil 5 kms  this is proposed house construction with in 5 to 6 months with customer pre planning gated community venture c.c roads available 24 hours water and electricity near by schools and hospitals loan approved with nationalized banks 79-80% near by ushodaya super market note : 10% amenities extra 5 % facing charges,"₹ 45,00,000",https://apollo-singapore.akamaized.net:443/v1/files/demy5fd5hnpi-IN/image,"India, Telangana, Hyderabad, Ahmadguda"
Fully Gated Community Plates For Sale in Patancheruvu,"745 Premium 1BHK & 2BHKApartment flats7.2 Acres - 14BlocksLuxury Club House = 16000sftWithin close vicinity Proximity to ORRJust 18km from Wipro circle financial distValue for money40% Open Area5 FLOORS PREMIUM 1BHK & 2BHK GATED COMMUNITYPaati Ghanpur, PatancheruFlats Sizes: 1BHK Sizes.  :650 SFT 2BHK Sizes   :910 SFTPrice : 3150/- Sq.ftBOOKING AMOUNT :RS: 50000 for 1BHKRS: 1lakh  for 2BHKRate : RS.3150/Sq.ft + Aminities + GST + RegistrationAminities: 3 lakhs for 1BHK & 4lakhs for 2BHKProject Highlights:Fully Gated CommunityClub HouseMini Function Hall with guest roomsIndoor GamesSwimming PoolBasket ball CourtGymChildren play areaCCTV Cameras24/7 Securityjogging tracksSolar Fencing.Location  Highlights:Just 0.7km from ORR Service Road5 Mins Drive From Mumbai National Highway20 Mins Drive From Lingampally25Mins Drive From Gachibowli.For more details Contact me.","₹ 28,66,500",https://apollo-singapore.akamaized.net:443/v1/files/6jebgpxc35zp3-IN/image,"India, Telangana, Hyderabad, Patancheru"
Kothaguda/HiTech-City for Couple/Bachelors Fully Furnished Rooms,"Fully furnished single/sharing PG Rooms are available for rent at prime location.Private Room - 10,000Sharing Room - 6,000","₹ 6,000",https://apollo-singapore.akamaized.net:443/v1/files/69ns3t5xg73z-IN/image,"India, Telangana, Hyderabad, Kothaguda"
1BHK Apartment in Manikonda near to IT SEZ Companies.,"1BHK for rent in Manikonda Puppalaguda, very near to main road market. No Car Parking.Two months Rent as Advance deposit.1BHK Monthly Rent - Rs: 10,500/- No monthly Maintenance.New construction  1BKH at 2nd floor With 2 bathrooms, 24x7  Lift/ elevator, water, Watch Man security, Fitted lights/Fans/Geyser & bike parking (no car parking) in Manikonda/ Puppalaguda at peaceful Friends colony.Very near /walkable distance to Bus stop, Market Shops, schools, hospitals.Just 15 mins drive to IT SEZ Companies Amazon/ Microsoft/ Oracle, etc.No Bachelors please, only families allowed.Available to move in immediately, please call 988500WT30  and setup visit time during 9am -10pm only.","₹ 10,500",https://apollo-singapore.akamaized.net:443/v1/files/88uvixesbinu-IN/image,"India, Telangana, Hyderabad, Manikonda"
